Category,Product Code,EAN Code,Product Name,Product Size,RRP,Price,VAT,Stock Service,Brand,Description,On Promo
Alcohol & Tobacco,708826,9300727406538	,JACOBS CREEK CHARDONNAY,6 x 750mls,£6.39,£29.79,20.0%,In Stock,Jacob's Creek,Jacob's Creek Chardonnay White Wine 75cl,No
Soft Drinks,915852,5054267011960	,LUCOZADE ORANGE SPORT 1.25,12 x 500mls,£1.25,£8.29,20.0%,In Stock,Suntory GB Ltd,Lucozade Sport Drink Orange 500ml PMP £1.25,No
Soft Drinks,915853,5054267011977	,LUCOZADE RASPBERRY 1.25,12 x 500mls,£1.25,£8.29,20.0%,In Stock,Suntory GB Ltd,Lucozade Sport Drink Raspberry 500ml PMP £1.25,No
Soft Drinks,915849,5054267012233	,LUCOZADE ZERO ORIG 1.25,24 x 380mls,£1.25,£14.29,20.0%,In Stock,Suntory GB Ltd,Lucozade Zero Original 380ml PMP  £1.25,No
Catering Dry Goods,416034,7613034538567	,NESCAFE AZERA,1 x 500grm,NA,£20.59,0.0%,In Stock,Nescafé,Find out more about Nescafe Gold at https://www.nestleprofessional.co.ukOr discover more from Nestle Professional  on Facebook https://www.facebook.com/NestleProfessionalUK/YouTube https://www.youtube.com/c/nestleprofessionalukTwitter  https://twitter.com/nestleproukInstagram https://www.instagram.com/nestleprouk/,No
Catering Dry Goods,416032,7613034538567	,NESCAFE AZERA,3 x 500grm,NA,£61.69,0.0%,In Stock,Nescafé,Find out more about Nescafe Gold at https://www.nestleprofessional.co.ukOr discover more from Nestle Professional  on Facebook https://www.facebook.com/NestleProfessionalUK/YouTube https://www.youtube.com/c/nestleprofessionalukTwitter  https://twitter.com/nestleproukInstagram https://www.instagram.com/nestleprouk/,No
Catering Dry Goods,189107,5000243600208	,NESCAFE GRANULES,1 x 1kgm,NA,£23.65,0.0%,In Stock,Nescafé,Find out more about our products at https://www.nestleprofessional.co.uk/Or follow us on Facebook https://www.facebook.com/NestleProfessionalUK/YouTube https://www.youtube.com/c/nestleprofessionalukTwitter https://twitter.com/nestleproukInstagram https://www.instagram.com/nestleprouk/,No
Soft Drinks,915847,5054267012165	,LUCOZADE ORANGE 1.25,24 x 380mls,£1.25,£14.29,20.0%,In Stock,Suntory GB Ltd,Lucozade Energy Drink Orange 380ml PMP £1.25,No
Soft Drinks,915848,5054267012172	,LUCOZADE ORIGINAL 1.25,24 x 380mls,£1.25,£14.29,20.0%,In Stock,Suntory GB Ltd,Lucozade Energy  Drink Original 380ml PMP £1.25,No
Catering Dry Goods,916800,3052911443947	,MONIN COLD BREW CONCENTRATE,1 x 70cl,NA,£9.99,0.0%,In Stock,Food Solutions Ltd,NA,No
Catering Dry Goods,124151,7613033694141	,NESCAFE GOLD BLEND DECAFSTICK,1 x 360grm,NA,£18.29,0.0%,In Stock,Nescafé,https://www.nestleprofessional.co.uk/sachets/nescafe-gold-blend-decaff-200-1-8g,No
Catering Dry Goods,124152,7613033694165	,NESCAFE GOLD BLEND STICKPACK,1 x 360grm,NA,£17.99,0.0%,In Stock,Nescafé,https://www.nestleprofessional.co.uk/sachets/nescafe-gold-blend-200-1-8g,No
Catering Dry Goods,916799,3052911443947	,MONIN COLD BREW CONCENTRATE,6 x 70cl,NA,£55.99,0.0%,In Stock,Food Solutions Ltd,NA,No
Catering Dry Goods,189106,5000243600208	,NESCAFE GRANULES,3 x 1kgm,NA,£70.95,0.0%,In Stock,Nescafé,Find out more about our products at https://www.nestleprofessional.co.uk/Or follow us on Facebook https://www.facebook.com/NestleProfessionalUK/YouTube https://www.youtube.com/c/nestleprofessionalukTwitter https://twitter.com/nestleproukInstagram https://www.instagram.com/nestleprouk/,No
Catering Dry Goods,916921,7613037433074	,KIT KAT MIX IN,1 x 400grm,NA,£3.45,0.0%,In Stock,Nestle UK Ltd,"For portions guidance, branding and recipes connect on www.nestleprofessional.comNestlé®Cocoa Plan®Working with Rainforest Alliance to support cocoa farmerswww.nestlecocoaplan.comFind out more at ra.org",No
Catering Dry Goods,916920,7613037433074	,KIT KAT MIX IN,8 x 400grm,NA,£27.49,0.0%,In Stock,Nestle UK Ltd,"For portions guidance, branding and recipes connect on www.nestleprofessional.comNestlé®Cocoa Plan®Working with Rainforest Alliance to support cocoa farmerswww.nestlecocoaplan.comFind out more at ra.org",No
"Confectionery, Crisps & Snacks",916515,5059321004384	,CRUNCHY NUT HAZELNUT BARS,12 x 45grm,£0.99,£6.99,20.0%,In Stock,Kelloggs,Enjoy as part of a balanced diet and active lifestyle,No
"Confectionery, Crisps & Snacks",793725,7622210296085	,BELVITA STRAW YOGURT,18X50.GRM,£0.69,£8.49,0.0%,In Stock,Belvita,Visit www.belvitamorning.com,No
"Confectionery, Crisps & Snacks",691831,7622210614742	,BELVITA SOFT C/CHIP 60P,20 x 50grm,£0.60,£7.99,0.0%,In Stock,Kraft Foods UK Ltd,Charter HarmonyEnjoy as part of a varied and balanced  diet and healthy lifestyle.Find more information on www.belvitamorning.com,No
"Confectionery, Crisps & Snacks",779398,7613287383969	,YORKIE DUO ORANGE,24 x 72grm,£0.89,£10.99,20.0%,In Stock,Nestle UK Ltd,"The chocolate used in Yorkie® has been produced under  The Nestlé Cocoa Plan™, which works with UTZ Certified to support cocoa farmers for better chocolate. Enjoying chocolate as part of a balanced diet and healthy lifestyle is one of  life's pleasures! If you want to know more, visit http://www.nestle.co.uk/brands, or our Facebook page at www.facebook.com/yorkieofficial.",No
"Confectionery, Crisps & Snacks",777929,7613287431042	,AERO PEPPERMINT BAR 60P,24 x 36grm,£0.60,£8.99,20.0%,In Stock,Nestle UK Ltd,"AERO is part of the Nestle Cocoa Plan, which works with UTZ to ensure a better future for cocoa farmers and even better chocolate for you. Find out more at www.nestlecocoaplan.comEnjoying chocolate as part of a varied, balanced diet and a healthy lifestyle, is one of life's little pleasures.Visit https://www.facebook.com/aerobubblychocolate or http://www.aerochocolate.co.uk/ for more information",No
"Confectionery, Crisps & Snacks",793560,7622201788322	,CADBURY CARAMILK,36 x 37grm,£0.85,£16.99,20.0%,In Stock,Kraft Foods UK Ltd,BeTreatwise.netCocoa LifePartnering with Fairtrade Foundationwww.cocoalife.org,No
Professional Cleaning & Hygiene,777532,5027279001618	,TEEPOL ALCOHOL HAND SANITISER,10 x 500mls,£8.95,£45.75,20.0%,In Stock,Teepol,Teepol Alcohol Hand Sanitizer 500ml,No
"Confectionery, Crisps & Snacks",738921,7613035052024	,AERO MILK BAR,24 x 36grm,£0.85,£8.99,20.0%,In Stock,Nestle UK Ltd,Aero® supports improving the lives of cocoa farmers and quality of cocoa through the Nestlé Cocoa Plan® and by working with the Rainforest Alliance. Learn more: www.nestlecocoaplan.comFind out more at ra.org,No
Professional Cleaning & Hygiene,768503,8001841709253	,BOLD LOTUS & LILLY 100 SCOOP,1X6.5KGM,NA,£12.99,20.0%,In Stock,Galgorm Chemicals Ltd,Bold 2in1 Professional Powder Detergent Lotus Flower & Water Lily 6.5kg 100 Washes,No
"Confectionery, Crisps & Snacks",697490,7613036521208	,LION BAR WHITE DUO,28X60GRM,£0.89,£12.99,20.0%,In Stock,Nestle UK Ltd,"Good Food, Good Life®NestleLearn more: http://www.nestle.co.uk/brands Good to remember: Enjoying chocolate as part of a varied, balanced diet and a healthy lifestyle, is one  of life's little pleasures.Cocoa Plan:Supporting farmers for better chocolate. Working with UTZ to support cocoa farmers. Find out more at www.nestlecocoaplan.com.Win a Staycation  Every Day††UK, IoM, CI, ROI. 18+. Open 03.05.21 - 27.06.21 & 2x late entry draws. No purchase necessary in NI. See back  for details. Scan the QR Code on the back of this pack to visit the promotional website.Plus 100s of Days Out Available  to be WonLuxury, Nature, AdventureGo to www.nestle-promotions.co.uk/staycation or scan the QR code on pack & enter your  name, email address & last 4 digits of your barcode for a chance to win a staycation every day (worth up to €/£1,500 each) or 1 of 100s days out (worth up to €/£100). Internet access required. Abridged Terms & Conditions: 1. See website or  call 00800 6378 5385 for full T&Cs, NI free mail-in entry route & further prize details. 2. 1 x staycation prize chosen  randomly each day from all valid daily entries via prize draw. 3. Staycation prizes consists of 1 x staycation, within UK or ROI, each worth up to €/£1,500 inc. €/£200 travel allowance. Locations, type of staycation & max capacity dependent on option chosen from list available, exclusions/terms may  apply. 4. 201 'days out' prizes to be won online via randomly allocated open winning moments where entry at, or first after the allocated winning moment wins. 5. 'Day out' prizes consists of 1 x 'day out', from predetermined list of day out options, up to the value of €/£100. 6. 1 x staycation & 10  x 'day out' prizes to be won in each late entry draw (ending: 19.09.21, & 03.05.22). 7. Max. 2 entries per person, per day, max. 1x prize tier/person & max. 1x prize tier/household. 8. Winners must retain promotional pack(s) & all receipts. 9. ROI: promotion carried out under licence granted to The  Jack & Jill Children's Foundation, Johntown, Naas, Co. Kildare.",No
Professional Cleaning & Hygiene,768499,8001841709239	,BOLD LAVENDAR & CAMOMILE100SCOOP,1X6.5KGM,NA,£12.99,20.0%,In Stock,Galgorm Chemicals Ltd,Bold 2in1 Professional Powder Detergent Lavender & Camomile 6.5kg 100 Washes,No
"Confectionery, Crisps & Snacks",696386,7613036512992	,LION BAR MILK DUO,28X60GRM,£0.89,£12.99,20.0%,In Stock,Nestle UK Ltd,Supporting farmers for better chocolate.The Nestlé Cocoa Plan® works with UTZ to ensure a better future for cocoa  farmers and even better chocolate for you.Learn more: www.nestlecocoaplan.com,No
"Confectionery, Crisps & Snacks",657821,7613035058347	,AERO PEPPERMINT BAR,24 x 36grm,£0.85,£8.99,20.0%,In Stock,Nestle UK Ltd,"AERO is part of the Nestle Cocoa Plan, which works with UTZ to ensure a better future for cocoa farmers and even better chocolate for you. Find out more at www.nestlecocoaplan.comEnjoying chocolate as part of a varied, balanced diet and a healthy lifestyle, is one of life's little pleasures.Visit https://www.facebook.com/aerobubblychocolate or http://www.aerochocolate.co.uk/ for more informationWin a Staycastion Every Day††UK, IoM, CI, ROI. 18+, Open (03.05.21 - 27.06.21 & 2x late entry draws. No purchase necessary in NI. See back for details. Scan the QR Code on the back of this pack to visit the promotional website.Plus 100s of Days Out Available to be WonLuxury, Nature, AdventureGo to www.nestle-promotions.co.uk/staycation or scan the QR code on pack & enter your name, email address & last 4 digits of your barcode for a chance to win a staycation every day (worth up to €/£1,500  each) or 1 of 100s days out (worth up to €/£100). Internet access required. Abridged Terms & Conditions: 1. See website  or call 00800 6378 5385 for full T&Cs, NI free mail-in entry route & further prize details. 2. 1 x staycation prize chosen randomly each day from all valid daily entries via prie draw. 3. Staycation prizes consists of 1 x staycation, within UK or ROI, each worth up to €/£1,500 inc. €/£200 travel allowance. Locations, type of staycation & max capacity dependent on option chosen from list available, exclusiond/terms may apply. 4. 201 'days out' prizes to be won online via randomly allocated open winning moments where entry at, or first  after the allocated winning moment wins. 5. 'Day out' prizes consists of 1 x 'day out', from predetermined list of day out options, up to the value of €/£100. 6. 1 x staycation & 10 x 'day out' prizes to be won in each late entry draw (ending: 19.09.21, & 03.05.22). 7. Max. 2 entries per person, per day, max. 1x prize tier/person & max. 1x prize tier/household. 8. Winners must retain promotional pack(s) & all receipts. 9. ROI: promotion carried out under licence granted to The Jack & Jill Children's Foundation, Johntown, Naas, Co. Kildare.",No
Professional Cleaning & Hygiene,799973,8006540345047	,BOLD LAV&CAMOMILE PODS 2X50,1 x 100pce,NA,£15.29,20.0%,In Stock,Galgorm Chemicals Ltd,Bold 3in1 Pods Washing Liquid Capsules Lavender & Camomile 100 Washes,No
Alcohol & Tobacco,752019,50226214	,COOKS SAFETY MATCHES,36X1PCE,£1.00,£19.29,20.0%,In Stock,Republic Tech Uk (ZIG ZAG ),Cook's Matches The Original Kitchen Safety Matches,No
Alcohol & Tobacco,755537,3179110001140	,CRICKET FIREPOWER LIGHTER,18X1PCE,£1.59,£17.99,20.0%,In Stock,Cricket,Cricket Outdoor & Home Refillable Firepower,No
Alcohol & Tobacco,694889,3086126788388	,BIC LIGHTER UTILITY U140,12X1PK,£4.99,£32.99,20.0%,In Stock,Bic,"BIC Megalighter Multi Utility Lighters - Assorted Colours, Pack of 1",No
Alcohol & Tobacco,740250,3086123417953	,BIC BL2 UTILITY LIGHTER,10X2PK,£6.99,£43.99,20.0%,In Stock,BIC UK LTD,NA,No
Alcohol & Tobacco,799239,5000143910636	,STERLING RYO ESSENTIAL NI,5 x 50grm,£22.35,£85.85,20.0%,In Stock,Gallaher Ltd,Sterling Rolling Tobacco Essential Pouches 5 x 50g,No
Professional Cleaning & Hygiene,916284,8001090289469	,BOLD LOTUS FLOWER & LILY95 WASH,1X4.7LTR,NA,£9.49,20.0%,In Stock,Galgorm Chemicals Ltd,Bold Professional Liquid Detergent Lotus Flower & Water Lily 95 Washes 4.75L,No
Alcohol & Tobacco,791700,5000143906936	,STERLING RYO ESSENTIAL NI,5X30GRM,£13.65,£52.99,20.0%,In Stock,Gallaher Ltd,Sterling Rolling Tobacco Essential 30g,No
Alcohol & Tobacco,779300,5000433025828	,JPS PLAYERS RYO NI,5X30GRM,£13.65,£53.35,20.0%,In Stock,Imperial Tobacco Ltd,JPS Players Easy Rolling Including Cigarette Papers 30g,No
Alcohol & Tobacco,779095,5000143997927	,STERLING RYO NI,5X30GRM,£14.60,£56.79,20.0%,In Stock,Gallaher Ltd,Sterling Rolling Tobacco 5 x 30g,No
Professional Cleaning & Hygiene,916283,8001090289469	,BOLD LOTUS FLOWER & LILY95 WASH,3X4.7LTR,NA,£29.65,20.0%,In Stock,Galgorm Chemicals Ltd,Bold Professional Liquid Detergent Lotus Flower & Water Lily 95 Washes 4.75L,No
Alcohol & Tobacco,779094,5000143998726	,STERLING RYO NI,5 x 50grm,£23.95,£93.09,20.0%,In Stock,Gallaher Ltd,Sterling Rolling Tobacco 50g,No
Alcohol & Tobacco,779088,5000143916317	,STERLING 3IN1 RYO NI,5X30GRM,£14.70,£57.05,20.0%,In Stock,Gallaher Ltd,Sterling Rolling Tobacco 3 in 1 30g,No
Alcohol & Tobacco,778835,5000435014295	,RIVERSTONE RYO NI,5X30GRM,£13.65,£53.39,20.0%,In Stock,Imperial Tobacco Ltd,Riverstone Easy Rolling Including Cigarette Papers 30g,No
"Biscuits, Bread & Cakes",794862,5010035068451	,FOXS W/CHOC COOKIES 1.69,8 x 180grm,£1.69,£8.29,0.0%,In Stock,GM Marketing,NA,No
"Biscuits, Bread & Cakes",916024,5010035068659	,FOXS VIENNESE CHOC 1.29,12 x 120grm,£1.29,£9.59,0.0%,In Stock,GM Marketing,Fox's Viennese,No
"Biscuits, Bread & Cakes",794861,5010035068468	,FOXS CHOC COOKIE 1.69,8 x 180grm,£1.69,£8.29,0.0%,In Stock,GM Marketing,FOX'S Fabulous,No
"Biscuits, Bread & Cakes",916023,5010035068628	,FOXS JAM CREAMS 99P,12 x 150grm,£0.99,£7.29,0.0%,In Stock,GM Marketing,FOX's Jam'n Cream Raspberry & Vanilla Flavour 150g,No
"Biscuits, Bread & Cakes",916929,5010035069342	,FOXS CHOCOLATE CREAMS 1.29,12 x 200grm,£1.29,£8.99,0.0%,In Stock,GM Marketing,Fox's Favourites Crunch Creams Chocolate & Cream 200g,No
"Biscuits, Bread & Cakes",916930,5010035069397	,FOXS ORANGE CREAMS 1.29,12 x 200grm,£1.29,£8.99,0.0%,In Stock,GM Marketing,Enjoy Wisely,No
"Biscuits, Bread & Cakes",916936,5010035069366	,FOXS GINGER CREAMS 1.29,12 x 200grm,£1.29,£8.99,0.0%,In Stock,GM Marketing,Fox Favourites Crunch Creams Ginger 200g,No
"Biscuits, Bread & Cakes",794860,5010035068475	,FOXS CHOC COOKIES 1.89,8X175GRM,£1.89,£8.29,20.0%,In Stock,GM Marketing,NA,No
"Biscuits, Bread & Cakes",620111,4028491401065	,QUICKBURY L/L MEGA BURGER BAPS 4PK,7 x 300grm,£1.59,£8.59,0.0%,In Stock,Quickbury,Quickbury Mega Burger 4 Buns,No
"Biscuits, Bread & Cakes",916935,5010035069373	,FOXS GOLDEN CREAMS 1.29,NA,NA,NA,0.0%,Out of Stock,GM Marketing,Enjoy Wisely,No
"Biscuits, Bread & Cakes",916651,652655001101	,BORDER LEMON DRIZZEL MELTS,12 x 150grm,£1.09,£10.39,0.0%,In Stock,United Biscuits Foods Division,We are happy to declaire that the palm oil contained within the ingredients we use is certified as sustainable.,No
"Biscuits, Bread & Cakes",916648,652655001231	,BORDER GINGER CRUNCH,6 x 150grm,£1.00,£4.79,0.0%,In Stock,United Biscuits Foods Division,We are happy to declare that the palm oil contained within the ingredients we use is certified as sustainable.,No
"Biscuits, Bread & Cakes",916649,652655001088	,BORDER BUTTERSCOTCH CRUNCH,12 x 135grm,£1.09,£10.39,0.0%,In Stock,United Biscuits Foods Division,We are happy to declaire that the palm oil contained within the ingredients we use is certified sustainable.,No
"Biscuits, Bread & Cakes",746187,5000168211671	,MCV NICE 1.00,12 x 250grm,£1.00,£8.99,0.0%,In Stock,United Biscuits,www.123healthybalance.com,No
Alcohol & Tobacco,916646,5000143970524	,MAYFAIR KS SILVER,10 x 20pk,£10.15,£80.59,20.0%,In Stock,Gallaher Ltd,Mayfair 20 Cigarettes Silver,No
"Biscuits, Bread & Cakes",620070,4028491401058	,QUICKBURY L/L HOT DOG BAP,8 x 250grm,£1.49,£8.49,0.0%,In Stock,Quickbury,Quickbury 4 Hot Dog Buns 250g,No
"Biscuits, Bread & Cakes",566671,4028491401072	,QUICKBURY L/L SESAME BURGER BAPS,8 x 300grm,£1.59,£9.29,0.0%,In Stock,Quickbury,Quickbury Burger 6 Buns,No
"Biscuits, Bread & Cakes",564551,4028491401089	,QUICKBURY L/L BURGER BAPS,8X6PK,£1.59,£9.29,0.0%,In Stock,Quickbury,Quickbury Burger 6 Buns 300g,No
"Biscuits, Bread & Cakes",916937,5010035069380	,FOXS D/CHOC CRUNCH 1.29,12 x 200grm,£1.29,£8.99,0.0%,In Stock,GM Marketing,Fox's Favourites Crunch Creams Double Choc 200g,No
"Biscuits, Bread & Cakes",916025,5010035068666	,FOXS PARTY RINGS 99P,12 x 125grm,£0.99,£7.79,0.0%,In Stock,GM Marketing,Fox's Party Rings 125g,No
Soft Drinks,915838,5054267012066	,LUCOZADE APPLE 1.25,12X380MLS,£1.25,£7.19,20.0%,In Stock,Suntory GB Ltd,Lucozade Energy Drink Apple Blast 380ml PMP £1.25,No
Soft Drinks,793349,5054267010611	,LUCOZADE ZERO TROPICAL,12 x 500mls,£1.79,£11.69,20.0%,In Stock,Suntory GB Ltd,Lucozade Zero Tropical 500ml,No
Soft Drinks,793348,5054267005051	,LUCOZADE ZERO PINK,12 x 500mls,£1.79,£11.69,20.0%,In Stock,Suntory GB Ltd,Lucozade Zero Pink Lemonade 500ml,No
Soft Drinks,915434,5054267009271	,LUCOZADE CITRUS CHILL,24 x 500mls,£1.69,£24.29,20.0%,In Stock,Suntory GB Ltd,Lucozade Energy Drink Citrus Chill 500ml,No
Soft Drinks,776647,5054267010710	,LUCOZADE ORANGE ENERGY,12X900MLS,£1.25,£11.99,20.0%,In Stock,Suntory GB Ltd,Lucozade Energy Drink Orange 900ml,No
Soft Drinks,776645,5054267010727	,LUCOZADE ORIGINAL ENERGY,12X900MLS,£1.25,£11.99,20.0%,In Stock,Suntory GB Ltd,Lucozade Energy Drink Original 900ml,No
Soft Drinks,787648,5054267011182	,LUCOZADE ORIGINAL 2.00 ENERGY,8X1.4LTR,£2.00,£10.49,20.0%,In Stock,Suntory GB Ltd,Lucozade Energy Drink Original 1.45L PMP £2.00,No
Soft Drinks,787653,5054267011175	,LUCOZADE ORANGE 2.00 ENERGY,8X1.45LTR,£2.00,£10.49,20.0%,In Stock,Suntory GB Ltd,Lucozade Energy Drink Orange 1.45L PMP £2.00,No
Soft Drinks,776704,5054267008793	,LUCOZADE ZERO ORIG 6PK,4 x 380mls,£3.50,£9.99,20.0%,In Stock,Suntory GB Ltd,Lucozade Zero Original 6 x 380ml,No
Catering Dry Goods,916682,5000225054418	,OLD BAY SEASONING,1 x 280grm,NA,£3.99,0.0%,In Stock,RH Amar Ltd,For information on this product and recipe suggestions: Visit www.oldbay.co.uk,No
Catering Dry Goods,784517,7613287139894	,MILKY BAR MIX IN,1 x 400grm,NA,£4.69,0.0%,In Stock,Nestle UK Ltd,NA,No
Catering Dry Goods,916681,5000225054418	,OLD BAY SEASONING,6 x 280grm,NA,£23.94,0.0%,In Stock,RH Amar Ltd,For information on this product and recipe suggestions: Visit www.oldbay.co.uk,No
Soft Drinks,793347,5054267005921	,LUCOZADE ZERO ORIGINAL,12 x 500mls,£1.79,£11.69,20.0%,In Stock,Suntory GB Ltd,Lucozade Zero Original 500ml,No
Soft Drinks,769202,5060639127917	,MONSTER MANGO 4PK,6 x 500mls,£3.99,£16.49,20.0%,In Stock,Coca Cola HBC Northern Ireland,Monster Energy Juice Mango Loco 4 x 500ml,No
Catering Dry Goods,784513,7613287139894	,MILKY BAR MIX IN,8 x 400grm,NA,£37.45,0.0%,In Stock,Nestle UK Ltd,NA,No
Catering Dry Goods,309294,5010421074455	,SFC BLACKENED CAJUN SEASONING,1 x 550grm,NA,£4.59,0.0%,In Stock,Schwartz,For information on this product and recipe suggestions:Visit: www.mccormickflavoursolutions.co.uk,No
Catering Dry Goods,447468,5099839605611	,MUSGRAVE SMARTBUY SALT,1 x 6kgm,NA,£5.35,0.0%,In Stock,Gem Pack Foods,Musgrave Smart Buy Salt 6kg,No
Catering Dry Goods,309293,5010421074455	,SFC BLACKENED CAJUN SEASONING,6 x 550grm,NA,£27.35,0.0%,In Stock,Schwartz,For information on this product and recipe suggestions:Visit: www.mccormickflavoursolutions.co.uk,No
Catering Dry Goods,603943,5000243895307	,NESCAFE COFFEE GRANULES,6 x 750grm,NA,£120.25,0.0%,In Stock,Nescafé,Find out more about our products at https://www.nestleprofessional.co.uk/Or follow us on Facebook https://www.facebook.com/NestleProfessionalUK/YouTube https://www.youtube.com/c/nestleprofessionalukTwitter https://twitter.com/nestleproukInstagram https://www.instagram.com/nestleprouk/,No
"Health, Beauty & Baby",915837,8006540584149	,ALWAYS ULTRA LONG,12X13PK,£1.99,£17.99,0.0%,In Stock,Interactive Irl Ltd,Always Ultra Sanitary Towels Long (Size 2) X13 Pads,No
"Health, Beauty & Baby",915835,8006540583982	,ALWAYS ULTRA NORMAL PLUS,16X15PK,£1.99,£23.99,0.0%,In Stock,Interactive Irl Ltd,Always Ultra Sanitary Towels Normal (Size 1) X15 Pads,No
Catering Dry Goods,784837,7613287167774	,MINI ROLO BULK,8 x 400grm,NA,£37.45,20.0%,In Stock,Nestle UK Ltd,NA,No
"Health, Beauty & Baby",915834,8006540584040	,ALWAYS ULTRA NORMAL,16X13PK,£1.99,£23.99,0.0%,In Stock,Interactive Irl Ltd,Always Ultra Sanitary Towels Normal (Size 1) Wings X13 Pads,No
"Health, Beauty & Baby",763077,871716369212	,LYNX B/SPRAY LEATHER & COOKIES,6 x 150mls,£2.65,£8.99,20.0%,In Stock,Unilever Ireland Personal Care,NA,No
"Health, Beauty & Baby",753476,8717163640838	,LYNX APA ICE CHILL,6 x 150mls,£2.65,£8.99,20.0%,In Stock,Unilever Ireland Personal Care,Lynx Ice Chill Anti-perspirant Deodorant Spray 150 ml,No
"Health, Beauty & Baby",915836,8006540584200	,ALWAYS ULTRA DAY & NIGHT,16X9PK,£1.99,£23.99,0.0%,In Stock,Interactive Irl Ltd,Always Ultra Sanitary Towels Day & Night (Size 3) Wings X9 Pads,No
"Health, Beauty & Baby",753475,8710447497302	,LYNX B/SPRAY ICE CHILL,6 x 150mls,£2.65,£8.99,20.0%,In Stock,Unilever Ireland Personal Care,Lynx Ice Chill Body Spray Deodorant 150 ml,No
"Health, Beauty & Baby",734700,8717644012208	,LYNX B/SPRAY AFRICA,6 x 150mls,£2.65,£8.99,20.0%,In Stock,Lynx,Lynx Africa Aerosol Bodyspray 150 ml,No
"Health, Beauty & Baby",665396,8710447250259	,LYNX APA GOLD,6 x 150mls,£2.65,£8.99,20.0%,In Stock,Unilever Ireland Personal Care,Lynx Gold Anti White Marks Anti-perspirant Deodorant Spray 150 ml,No
"Health, Beauty & Baby",673995,8718114650197	,LYNX B/SPRAY EXCITE,6 x 150mls,£2.65,£8.99,20.0%,In Stock,Lynx,Lynx Excite Aerosol Bodyspray 150 ml,No
"Health, Beauty & Baby",689865,8710447248997	,LYNX B/SPRAY GOLD,6 x 150mls,£2.65,£8.99,20.0%,In Stock,Unilever Ireland Personal Care,Lynx Gold Bodyspray 150 ml,No
"Confectionery, Crisps & Snacks",178888,5000312002131	,CADBURY PICNIC,36 x 48grm,£0.85,£16.29,20.0%,In Stock,Cadbury,BeTreatwise.netCocoa LifePartnering with Fairtrade Foundationwww.cocoalife.org,No
"Health, Beauty & Baby",447988,5029053532608	,KOTEX MAXI SUPER 1.15,12X14PK,£1.15,£9.29,0.0%,In Stock,Kotex,Kotex Maxi Super 14 Pads,No
"Health, Beauty & Baby",447987,5029053532622	,KOTEX MAXI NIGHT 1.15,12X10PK,£1.15,£9.29,0.0%,In Stock,Kotex,Kotex Maxi Night-Time x 10,No
"Health, Beauty & Baby",755754,8001841267173	,PANTENE S/POO SMOOTH SLEEK,6X360MLS,£2.39,£8.99,20.0%,In Stock,Interactive Irl Ltd,Pantene Pro-V Smooth & Sleek Silicone Free Frizz Ease  Shampoo Pro-V Formula With Argan Oil 360ML,No
"Health, Beauty & Baby",425344,7322540528718	,BODYFORM ULTRA NIGHT 1.49,6X10PK,£1.49,£5.99,0.0%,In Stock,Bodyform,Triple Protection against leakage with:1. Anti-leak walls2. Fast Absorption Core3. All-around barrier,No
"Health, Beauty & Baby",447986,5029053532660	,KOTEX MAXI NORMAL 1.15,12X16PK,£1.15,£9.29,0.0%,In Stock,Kotex,Kotex Maxi Normal 16 Pads,No
"Health, Beauty & Baby",755750,8001841267029	,PANTENE S/POO CLASSIC CLEAN,6X360MLS,£2.39,£8.99,20.0%,In Stock,Interactive Irl Ltd,Pantene Pro-V Classic Clean Clarifying Shampoo Pro-V Formula+Active Nutrients 360ML,No
"Health, Beauty & Baby",766992,50375301	,KLEENEX BALSAM HANKIES,18X1PK,£0.30,£3.19,20.0%,In Stock,Kleenex,Kleenex® Balsam TissuesSingle Pocket Pack 4 ply Tissue,No
"Health, Beauty & Baby",759396,5029053573281	,KLEENEX ORIGINAL EX LARGE,8X2PK,£2.79,£14.99,20.0%,In Stock,Kimberley Clark Ltd,www.kleenex.co.uk,No
"Health, Beauty & Baby",775577,5029053550039	,HUGGIES WIPES,6X1PK,£1.00,£4.29,20.0%,In Stock,Kimberley Clark Ltd,http://www.huggies.co.uk/,No
"Health, Beauty & Baby",755836,8001841041360	,PAMPERS SCENTED WIPES,12X52PK,£1.00,£7.69,20.0%,In Stock,Interactive Irl Ltd,Pampers Fresh Clean Baby Wipes 1 Pack = 52 Baby Wet Wipes,No
"Health, Beauty & Baby",755835,8001841041391	,PAMPERS SENSITIVE WIPES,12X52PK,£1.00,£7.69,20.0%,In Stock,Interactive Irl Ltd,Pampers Sensitive Baby Wipes 1 Pack = 52 Baby Wet Wipes,No
"Health, Beauty & Baby",405498,8711700943451	,RADOX SHOWER FEEL ENERGISED,6 x 250mls,£1.29,£4.29,20.0%,In Stock,Radox,Radox Feel Energised Shower Gel 250 ml,No
"Health, Beauty & Baby",405507,8711700943536	,RADOX SHOWER FEEL UPLFTED,6 x 250mls,£1.29,£4.29,20.0%,In Stock,Radox,Radox Feel Uplifted Shower Gel 250 ml,No
"Health, Beauty & Baby",914994,7322541049052	,BODYFORM ULTRA LONG 1.49,16X8PK,£1.49,£15.99,0.0%,In Stock,SCA Hygiene Ltd,"Bodyform Long Towel with Wings, New Cour-V™ Adaptive Technology 8 pcs",No
"Health, Beauty & Baby",914993,7322541067728	,TENA DISCREET EXTRA PLUS,6X8PK,£3.09,£13.85,0.0%,In Stock,SCA Hygiene Ltd,TENA Lady Discreet Extra Plus incontinence Pads 8 pack,No
"Health, Beauty & Baby",914992,7322540455236	,TENA DISCREET MAXI#,3X6PK,£3.09,£6.95,0.0%,In Stock,SCA Hygiene Ltd,TENA Discreet Maxi Night Incontinence Pads 6 Pack,No
"Health, Beauty & Baby",914991,7322541048970	,BODYFORM U/N WINGS 1.49,12X10PK,£1.49,£11.99,0.0%,In Stock,SCA Hygiene Ltd,"Bodyform Normal Ultra Towel with Wings, New Cour-V™ Adaptive Technology 10 pcs",No
